{
  "orf_version": "0.1.0",
  "receipt": {
    "receipt_id": "BELLA-20241228-003421",
    "issue_timestamp": "2024-12-28T19:34:21-05:00",
    "receipt_type": "sale",
    "status": "issued"
  },
  "merchant": {
    "merchant_id": "BELLA-NYC-001",
    "legal_name": "Bella Trattoria Inc.",
    "display_name": "Bella Trattoria",
    "country_code": "US",
    "tax_identifiers": [
      {
        "scheme": "US_EIN",
        "value": "98-7654321"
      }
    ]
  },
  "line_items": [
    {
      "line_item_id": "1",
      "description": "Margherita Pizza - Wood-fired, fresh mozzarella",
      "quantity": 1,
      "unit_price": 18.00,
      "net_amount": 18.00,
      "line_total": 18.00
    },
    {
      "line_item_id": "2",
      "description": "Caesar Salad - no anchovies, extra parmesan",
      "quantity": 1,
      "unit_price": 12.00,
      "net_amount": 12.00,
      "line_total": 12.00
    },
    {
      "line_item_id": "3",
      "description": "House Red Wine - Glass",
      "quantity": 2,
      "unit_price": 9.00,
      "net_amount": 18.00,
      "line_total": 18.00
    }
  ],
  "tax": {
    "tax_scheme": "US_SALES_TAX",
    "tax_lines": [
      {
        "rate": 0.08875,
        "base_amount": 48.00,
        "tax_amount": 4.26,
        "jurisdiction": "US-NY-NYC"
      }
    ]
  },
  "payment": {
    "payment_method": "card",
    "provider": "Mastercard"
  },
  "total": 62.26,
  "currency": "USD",
  "extensions": {
    "tip": {
      "amount": 10.00,
      "percentage": 0.208
    },
    "restaurant": {
      "table_number": "7",
      "server_name": "Maria",
      "party_size": 2
    },
    "us_sales_tax": {
      "state": "NY",
      "local_jurisdiction": "New York City",
      "nexus": true
    }
  }
}
